delivery_price,delivery_rating,name,no_of_review,price,rating,seller,seller_rating,stock
50.0,100.0,Tws Wireless Bluetooth Airbuds Charging Case Super Sound,50.0,50.0,0.0,Dashain Dhamaka,86.0,1.0
130.0,97.0,Combo of Gaming Mouse and Keyboard - T-WOLF T20 RGB LED Backlight USB Mechanical Gaming Keyboard With Multimedia Keys Support,130.0,130.0,0.0,Best Authorise,85.0,6.0
53.0,100.0,Maha Shree Dhan Laxmi Kuber Bhandari Yantra Generate A Source Of Income For You Decorative Showpiece - 20 Cm,53.0,53.0,0.0,ShopHill,85.0,15.0
102.0,100.0,"Viral Silvertek - 3000W Multiplug with C-Type Port, 3 USB Port & 6 charging port | Hot & Trendy item | Hot selling",102.0,102.0,0.0,Crazy NepDeals,91.0,15.0
25.0,98.0,Artificial Vagina Masturbator Sex Toys For Men,25.0,25.0,0.0,Sasto Bazar.,77.0,3.0
763.0,98.0,"Storage Box Foldable Clothing Storage Bag for Clothes, Blanket, Comforter, Under Bed Storage - Storage Bags",763.0,763.0,0.0,PlyBuy,80.0,14.0
43.0,100.0,Desktop Mobile Phone Holder Mount Stand Flexible Foldable Portable | Foldable Mobile Stand Table top Stand Adjustable Phone Holder,43.0,43.0,0.0,All In  One,0.0,7.0
47.0,100.0,Pal Pal Jaiphal Oil TM Regd.Original Pain Relief and Refreshment Massage Oil 200 ml,47.0,47.0,0.0,Dashain Dhamaka,86.0,15.0
357.0,100.0,"Mantra Avatar Semi Acoustic Guitar - 3 Band Equalizer and Tuner With Free Padded Bag, Capo, Strap, String and Picks",357.0,357.0,4.8,Mantra,89.0,12.0
23.0,98.0,Flysky Fs-I6 Remote For Quadcopter,23.0,23.0,4.8,Supreme Light Technology,88.0,1.0
1.0,100.0,Fashion Belt For Ladies - Multicolor | Free Size | Fashion | Belts For Women | Women's Wear | Fashion Belts |,1.0,1.0,4.8,Megha Market ,90.0,15.0
509.0,78.0,Home Wall Decoration Beautiful Diamond Shelf Rack In Black - Multi-layered Wall Mount Design Shelf Rack 3pc,509.0,509.0,4.8,Komal International,86.0,5.0
14.0,97.0,Microfiber Squeeze Mop for Floor Cleaning Hand-Free Wash Self Wringing Flat Mop,14.0,14.0,4.8,Aafno Pasal,79.0,15.0
34.0,97.0,Leather Side Bag Business Cross-body Messenger Bag For Men - Black | Fashion Leather Cross Body Bag For Men,34.0,34.0,4.8,ALLSANGAMTAILORS,88.0,15.0
24.0,100.0,Hibiscus Tea - Nepal Tea Exchange - 15g,24.0,24.0,4.8,Nepal Tea Exchange,93.0,15.0
10.0,85.0,Csn York 30kg Steel Dumbbell Set Adjustable (2 in 1) 30 Cm Connector,10.0,10.0,0.0,cybershop nepal (csn),95.0,1.0
4.0,88.0,Dr. Sheth's Extra Gentle Peel 30ml,4.0,4.0,4.5,Dr Sheth's,90.0,1.0
12.0,85.0,Cold Weather Cotton Lined Warm Men's Thermal Set,12.0,12.0,4.5,skr store,73.0,15.0
212.0,94.0,ShopMee Summer Men' Stylish Combo Set Of Half-Pant And Tshirt,212.0,212.0,4.5,Shop Mee,75.0,15.0
1.0,100.0,Special White Tea For Skincare and Anti-Aging - Nepal Tea Exchange - 60gm,1.0,1.0,4.5,Nepal Tea Exchange,93.0,15.0
4.0,100.0,Samsung WT70M3000UU/TL 7Kg Semi Automatic washing Machine,4.0,4.0,4.5,Maa Manakamana Suppliers,92.0,1.0
17.0,100.0,"Mens Solid Cuffed Sweatpants - Soft, Breathable, Regular Fit with Drawstring, Multiple Pockets for Jogging, Running, Fitness, and Everyday Wear - Versatile, Comfortable, and Stylish Trousers for Active Men",17.0,17.0,5.0,Fashion_House,71.0,10.0
11.0,100.0,Infinix Smart 8 Pro || 50 MP Camera || 5000 mAh Battery,11.0,11.0,4.9,M.G.CENTRE,93.0,1.0
4.0,100.0,Women Waist Shapewear | Women Panty Butt Lifter Shapewear | Tummy Control Panties | Shapewear Underwear Panties,4.0,4.0,4.9,Smart Buy Online,0.0,10.0
28.0,96.0,boAt Smartwatch WAVE CALL 2 | Bluetooth Calling | 1.83 Inch HD Display | 700 + Activities Modes | 1000 + Cloud Watch Faces | Crest OS+ App Support,28.0,28.0,0.0,boAt,84.0,1.0
16.0,96.0,boAt AIRDOPES FLEX 454 ANC |  Premium Wireless Earbuds | 60 Hours of Playback | Industry Leading ANC Playback |   Active Noise Cancellation Upto 32 dB | Multi Connectivity | Smart Features | App Support,16.0,16.0,0.0,boAt,84.0,1.0
6.0,0.0,5 Pcs Korean New Floral Heart Elastic Hair Bands Simple Hair Rope Hair Bands for Girls Headwear Children Kids Hair Accessories - Random,6.0,6.0,0.0,Shishtataa (Suzata Group),0.0,15.0
11.0,0.0,Nipple Paste Reusable Self-Adhesive Silicone Breast Nipple Cover Free Size For Women (Expiry : 2028),11.0,11.0,0.0,Reju Store,0.0,15.0
17.0,0.0,Storage Box 66 ltr Foldable Large Capacity Oxford Cloth Clothes Sundries Organizer Case for Household (multicolor),17.0,17.0,0.0,Hajurko Online Store,0.0,0.0
1.0,100.0,Grey Color Winter Plush Warm Home Cotton Indoor House Unisex Slides Slippers,1.0,1.0,0.0,Comfort Corner,87.0,10.0
1.0,0.0,MumBuds American UltraThin Baby Diaper Newborn 22Pcs,1.0,1.0,5.0,MumBuds USA,0.0,15.0
3.0,100.0,"1 Pc Exfoliating Shower Bath Glove  for Shower,Spa,Massage and Body Scrubs,Dead Skin Cell Remover Solft and Suitable",3.0,3.0,5.0,Bajra Beauty,85.0,15.0
4.0,0.0,MumBuds American Ultrathin Baby Diapers Small 48 Pcs,4.0,4.0,0.0,MumBuds USA,0.0,6.0
4.0,100.0,YESPLUS Bluetooth Digital Alarm Clock Wireless Speaker with Dual Alarms and Colorful LED Light (YS-702) | Rechargeable Mirror Clock for Living Room Bedroom Kids Room,4.0,4.0,0.0,All In  One,0.0,15.0
8.0,100.0,4 in 1 Fast Charging Cable (Type C/USB A/Lightning) Dual Type C PD 27W 65W Nylon Braided Cable | Flat Braided i-Phone Charging Cable with Velcro Multi Charging Cable Combo Type C/USB-A Ports,8.0,8.0,0.0,All In  One,0.0,7.0
1.0,100.0,"Xiaomi Redmi 14C 4G (6/128GB) | 6.884in Display | MediaTek Helio G81 Ultra | 5160mAh Battery""",1.0,1.0,0.0,Mobile Hub,86.0,1.0
1.0,0.0,MumBuds American UltraThin Baby Pants XXL 34Pcs​​,1.0,1.0,0.0,MumBuds USA,0.0,15.0
2.0,0.0,MumBuds American UltraThin Baby Pants XL 36Pcs,2.0,2.0,5.0,MumBuds USA,0.0,10.0
1.0,94.0,Shopmee Men's  Winter Warm Stylish Puffer Jacket With Fur|BPF,1.0,1.0,0.0,Shop Mee,75.0,5.0
11.0,0.0,"(New Launch) Ultima Boost 20K Ultra 20000mAh Powerbank with 65W Fast Charging | LED Display | Triple Ports |  Supports PD, QC3.0, Universal Compatibility | 2 Way Charging | ChargeSafe technology Power bank",11.0,11.0,1.0,Ultima Lifestyle,87.0,1.0
13.0,100.0,Tulip Active Steel Mug 500Ml Steel Vaccum Mug,13.0,13.0,1.0,Tulip_Home_Appliances,0.0,15.0
1.0,94.0,Sweatshirts for Men| Winter Warm | Comfortable Black & White Design |MM5,1.0,1.0,4.5,Shop Mee,75.0,15.0
108.0,0.0,(New Launch) Ultima Prime 1.0 ANC Earbuds with App Support | 60Hrs Playtime | Dual Pairing | EQ Modes | Supreme Sound | 4Mics AI ENC | Game Mode(40ms) | Elegant Appeal | Premium wireless earbuds,108.0,108.0,4.5,Ultima Lifestyle,87.0,1.0
24.0,0.0,"(New Launch) Ultima Active Smartwatch: Sporty & Rugged Built, 1.43” TRU AMOLED display, BT Calling, 24/7 health tracking,  100+ sports modes, SOS, IP68 Waterproof smart watch",24.0,24.0,4.5,Ultima Lifestyle,87.0,1.0
19.0,0.0,"Vaseline Gluta-Hya Dewy Radiance Serum-In-Lotion, 200ml",19.0,19.0,0.0,Unilever,92.0,1.0
1.0,100.0,Men's Splicing Pullover Hooded wind cheater,1.0,1.0,0.0,Lyra,0.0,5.0
6.0,100.0,Jaiphal Pain Relief Massage Oil 100ml,6.0,6.0,0.0,Chinari shop,0.0,15.0
1.0,97.0,Tailor Stitch E-Zhen New Full Sleeve Korean Design T-Shirt For Women,1.0,1.0,0.0,Tailor Stitch,83.0,10.0
2.0,94.0,Iphone Three Pin Charger 20W Power Adapter With USB-C To Lightning Cable For X To 14 Pro Max,2.0,2.0,0.0,ElectraByte,82.0,15.0
3.0,0.0,The Metamorphosis by Franz Kafka,3.0,3.0,1.7,Lakhe Book Store,0.0,0.0
2.0,100.0,Hot & Cold Thermos Bottle With Temperature Display Indicator | Insulated Stainless Steel | Smart Water Bottle | Double Wall Vacuum Cup | Hot and Cold,2.0,2.0,0.0,Crazy NepDeals,91.0,15.0
1.0,100.0,Solid Noise Canceling Isolating Earphones Compatible with Phone 15 Smartphone and Other USB C Device,1.0,1.0,0.0,Diraz np,0.0,15.0
1.0,100.0,Casual Canvas Trendy Sneakers For Men,1.0,1.0,0.0,Jutta Ghar Nepal,76.0,2.0
3.0,100.0,EnchantedRomantic Deo Spray Perfume 150 ml✨️,3.0,3.0,0.0,Awesome Cosmetic,0.0,15.0
2.0,97.0,Cute Cotton Terry Jacket For Women,2.0,2.0,4.1,Tailor Stitch,83.0,10.0
20.0,100.0,"7 in 1 Cleaner Kit, Multi-Function Earbud Cleaning Pen, Soft Brush Corner Gap Duster Keycap Puller Laptop Screen Cleaner",20.0,20.0,0.0,All In  One,0.0,15.0
13.0,100.0,FL1P6 Wireless Bluetooth Speaker Outdoor Riding Card Audio Mp3 Music Player Support Aux Audio Input USB Playback,13.0,13.0,0.0,All In  One,0.0,15.0
9.0,100.0,Lyra Kalaifu Clips for Women,9.0,9.0,4.7,Lyra,0.0,2.0
18.0,100.0,"Mini-311 Premium Bluetooth Speaker: FM Radio, Memory Card Slot, USB Drive Port, and Enhanced Sound Quality",18.0,18.0,0.0,All In  One,0.0,15.0
1.0,0.0,SB Dunk Low Pro Red/Black Premium Sneaker for Men,1.0,1.0,0.0,The Shoe Gallery,83.0,12.0
4.0,100.0,Lyra Hair Band,4.0,4.0,0.0,Lyra,0.0,2.0
7.0,98.0,Men's Stylish Vintage Front Pocket Leather Jacket .,7.0,7.0,0.0,Ramro Chha,82.0,1.0
1.0,100.0,Nuga: Lip Balm - Peach - 5gms,1.0,1.0,0.0, Nuga:,0.0,15.0
6.0,0.0,"Hard Zippered Sunglasses, Spectacles, Eyewear, Sports Glasses Protective Case/Cover",6.0,6.0,0.0,First Looks,0.0,15.0
9.0,100.0,"2-Piece Elegant Kitchen Mat Set -Non-Slip, Absorbent, Easy-Clean Comfort (120x40cm & 60x40cm)",9.0,9.0,0.0,Home Essentials,75.0,15.0
3.0,100.0,Unisex Classic Slip-On Checkerboard Loafers and Moccasins,3.0,3.0,0.0,Jutta Ghar Nepal,76.0,3.0
1.0,100.0,Multi Colour Eyeshadow Palette,1.0,1.0,3.0,Awesome Cosmetic,0.0,15.0
3.0,100.0,Seamless Panties For Women's  | Invisible Design Smooth Stretch Fabric Seamless Panties (3 Pack) Colour Random,3.0,3.0,0.0,Smart Buy Online,0.0,15.0
1.0,88.0,Fashion Gradient Color PC Round Frame Half Frame Sunglasses for Women,1.0,1.0,0.0,BLES ONLINE,88.0,0.0
2.0,100.0,10 Inch Fully Flexible Foldable Gorilla Tripod With Socket Holder,2.0,2.0,0.0,MixMart,0.0,15.0
3.0,100.0,Golden Non Waterproof Watch For Women,3.0,3.0,0.0,Microtel Gadgets,82.0,15.0
14.0,95.0,"Zeblaze Ares 3 Plus Smart Watch | 1.43"" Ultra HD Amoled Display | New 3D Interactive Experience | Bluetooth Calling | IP68 Water Resistance | 1 Year Warranty |",14.0,14.0,0.0,Zeblaze,85.0,1.0
4.0,100.0,Pack of 2 Man Boxer Cotton Underwear shorts Brifs (Color /Print  May vary),4.0,4.0,4.8,Megha Market ,90.0,15.0
72.0,85.0,Rimless Non Polarized Flat Square Black Sunglasses For Men,72.0,72.0,4.8,New national chasma ghar,84.0,0.0
3.0,100.0,COMBO -Kaju 200 Gm Pista 200 Gm Badam 200 Gm Kismis 200 gm Okhar Gudi 200 Gm Packet-Fresh And crunchy,3.0,3.0,4.8,Sampurna Nepal,84.0,1.0
1.0,100.0,Black 100% Original Leather Casual Bi Fold Wallet For Men | Black Solid Casual Purse With Card Holder Compartment,1.0,1.0,4.6,Haji Traders,85.0,15.0
5.0,100.0,"Infinix GT 20 Pro 5G (12/256GB) | 6.78"" Full HD+ 144Hz Amoled Display | MediaTek Dimensity 8200 ultimate 4nm 5G Processor | 5000mAh Battery | 45W Fast Charging",5.0,5.0,4.6,Mobile Hub,86.0,15.0
42.0,0.0,Ncell Wirefree Ma Ultima Gadgets Free Offer. Get 12 Months of Unlimited Internet With Free Ultima AMOLED Smartwatch (Worth Rs. 5999) + Free 4G Router + Free SIM Card (5GB Data & 100 Local Minutes),42.0,42.0,4.6,Ultima X Ncell,0.0,0.0
6.0,76.0,"Redmi 13 (6/128) | 6.79"" FHD+ DotDisplay | MediaTek Helio G91-Ultra processor | 5030mAh (typ) Battery",6.0,6.0,0.0,Xiaomi,90.0,1.0
33.0,100.0,Boxer Cotton 2pack Men Breathable Cool Loose Multicolor Boxer,33.0,33.0,3.3,Megha Market ,90.0,3.0
1.0,95.0,"Zeblaze Thor SQ ANDROID 4G Smart Watch | 2.13"" Ultra HD AMOLED DISPLAY | FRONT CAMERA GOOGLE MAPS | ANDROID OS* SUPPORTS GOOGLE PLAY | 2+16GB | SIM CARD |",1.0,1.0,3.9,Zeblaze,85.0,1.0
150.0,100.0,"Hair Wax Stick For Women Hair Styling, Wax Stick for Hair",150.0,150.0,3.9,Parmeshwar cosmetic,83.0,15.0
22.0,100.0,Belt high Quality,22.0,22.0,3.9,Megha Market ,90.0,11.0
6.0,100.0,Smartwatch Strap For  Size 49mm 45mm 44mm 42mm,6.0,6.0,5.0,Dashain Dhamaka,86.0,15.0
3.0,100.0,SB Dunk Low Pro Sail Pacific Moss Premium Sneaker for Men,3.0,3.0,5.0,Shoes Spot,76.0,5.0
7.0,94.0,25W Charger Adapter+USB-C To Lightning Cable For X To 14 Pro Max,7.0,7.0,4.0,ElectraByte,82.0,15.0
2.0,100.0,INGCO 800W SDS Plus Rotary Hammer With 3 Drills and 2 Chisels RGH9028,2.0,2.0,4.1,INGCO store,91.0,10.0
60.0,100.0,"Soundcore H30i Wireless On-Ear Headphones, Foldable Design, Pure Bass, 70H Playtime, Bluetooth 5.3, Lightweight and Comfortable, App Connectivity, Multipoint Connection (Black)",60.0,60.0,4.0,Anker,91.0,1.0
124.0,92.0,"Wellcore - Pure Micronised Creatine Monohydrate Power (100gm,33 Servings) Lab Tested | Unflavored | Rapid Absorption | Enhance Muscle Strength and Power | Fast Recovery | Increased Muscle Mass",124.0,124.0,4.0,Nepal Enterprises,78.0,0.0
25.0,99.0,SPN's 5Kg Rubber Hex Dumbbell set With Metal Handle - 1 Pc | Rubber Coated Hex Dumbbell With Silver Chrome Casted Handle - 5KG ( Single Piece),25.0,25.0,4.0,SPN'S,90.0,1.0
3.0,0.0,Apple iPhone 11 (128GB) | A13 Bionic 64-bit Processor,3.0,3.0,4.0,Tech Bazar,100.0,2.0
4.0,100.0,Pilgrim Tea Tree Purifying Gel Face Wash 100 ml,4.0,4.0,4.1,Pilgrim,88.0,15.0
2.0,100.0,Pilgrim Tea Tree Light Non-oily Moisturizer 80 gm,2.0,2.0,4.1,Pilgrim,88.0,15.0
140.0,100.0,6 layers Stainless Steel Durable 12mm pipe Multipurpose Shoe Rack,140.0,140.0,5.0,Home Essentials,75.0,15.0
6.0,100.0,Shoes Cleaner Kit For Sneakers/Sports/Leather,6.0,6.0,3.0,Shoes Spot,76.0,15.0
99.0,100.0,Black Leather Classic Martin Boots For Men,99.0,99.0,4.8,Ambe Laxmi General Stores,72.0,15.0
8.0,90.0,Bella Vita Organic Ceo Perfume For Women - 100 Ml,8.0,8.0,4.0,Bella Vita,88.0,15.0
2.0,100.0,Children My First Librarian Book ( Set of 10 ),2.0,2.0,4.0,Nepal Toys Store,78.0,15.0
2.0,97.0,V14 Drone 4K Profession HD Wide Angle Camera 1080P WiFi FPV Drone Dual Camera Height Keep Drone Camera,2.0,2.0,4.0,ASAP Store,75.0,1.0
2.0,100.0,Custom Mens Body Building Training Jogging Running Shorts Men's Single Layer GYM Athletic Fitness Short Pants,2.0,2.0,5.0,Fashion_House,71.0,3.0
13.0,83.0,Black Ankle Cut Printed Bandana Synthetic Round Toe Lace-Up Closure Medium Black Ankle Cut Printed Bandana Synthetic Round Toe Lace-Up Closure Medium Width Casual/Sport Sneakers For WomenCasual/Sport Sneakers For Men And Women,13.0,13.0,5.0,Badimalika Impex,84.0,10.0
75.0,100.0,"OnePlus Nord CE3 5G |12GB RAM, 256 GB Storage | Snapdragon™ 782G | 80W SUPERVOOC Charge | 17.02cm 120 Hz Fluid AMOLED + Dual Speakers",75.0,75.0,5.0,ONE PLUS,92.0,1.0
17.0,100.0,Bandana Print Premium Fashion Sneakers For Men,17.0,17.0,4.3,Shoes Spot,76.0,10.0
1.0,100.0,Artificial Fabric Made Ivy Garlands Round Leafs Creepers Silk Greenery Hanging Vines Garlands Creeper Leaves for Decoration( 5 Pec in One Packet),1.0,1.0,4.0,Mero Interior,73.0,15.0
5.0,0.0,HIMSTAR 32 inch HD Smart Television - HT-32SFE0NI/VI,5.0,5.0,4.9,Smart Enterprises,100.0,1.0
1.0,95.0,6in1 Baby Carrier Upto 20kg 0-36 Months Baby Carrier Bag,1.0,1.0,4.3,Royal fitness,80.0,15.0
502.0,99.0,Pack Of 2 Storage Box Foldable Large Capacity Oxford Cloth Clothes Sundries Organizer Case For Household 66ltr,502.0,502.0,4.3,7Rings,85.0,0.0
52.0,97.0,Half Zip Chain Sweatshirt For Women,52.0,52.0,4.3,Tailor Stitch,83.0,10.0
3.0,0.0,Crocodile | Medium (24 inch) | Hard | 100% Polypropylene (PP) | 8 Wheeler Travel | Expandable | Anti Theft | TSA Lock,3.0,3.0,4.3,Crocodile Nepal Official,88.0,1.0
3.0,94.0,Triple Camera K6 Max Drone for Outdoor-,3.0,3.0,4.8,New Idea,78.0,1.0
1.0,100.0,Levis 511™ Slim Denim Pant (Jeans) For Men 18298-1302,1.0,1.0,4.8,Levis,91.0,1.0
9.0,100.0,OGAS Spot - Water Spot And Stain Remover for Car's Windows and All Hard Surfaces,9.0,9.0,4.3,OGAS,85.0,1.0
32.0,100.0,"VESTEL 43"" Smart TV | 2/16GB | Ultra Remote | 3 Years Warranty | Free Wall Mount | Google Certified | IPS Panel | FULL HD | 43 Inch Smart Television",32.0,32.0,4.6,VESTEL,83.0,1.0
4.0,98.0,UNO The Classic Playing Card Game,4.0,4.0,4.4,Sansa Store,78.0,15.0
332.0,96.0,boAt NIRVANA ION| Premium Wireless Earbuds | 120 Hrs of Long Playback | 24 Hour of Industry best Bud Battery | Crystal Bionic Sound | Dual EQ Modes,332.0,332.0,5.0,boAt,84.0,1.0
117.0,80.0,Titex White Color Simple Fashionable Sneakers For Women-1202,117.0,117.0,5.0,TITEX,84.0,5.0
53.0,100.0,Winter Fake Skin Transparent High Waist Stretchy Leggings Stockings From Sale Sansar For Women,53.0,53.0,3.6,E-Market,85.0,15.0
1148.0,0.0,Ultima Atom 520 Pro Earbuds With 45Hrs Playtime| Game Mode(60ms)| Quad Mic| IPX5 Rated| Loud Sound & Deep Bass| Type-C Charging Port Wireless Earbuds,1148.0,1148.0,3.6,Ultima Lifestyle,87.0,1.0
39.0,98.0,1Pcs Multicolor stretchable Cloth Drying Rope With Clip,39.0,39.0,3.6,The Best Price Online,79.0,15.0
74.0,80.0,Titex Pink Color Simple Fashionable Sneakers For Women-1105,74.0,74.0,4.1,TITEX,84.0,2.0
2.0,80.0,Titex Black Color Simple Design Flat Sandal For Women (Art No:2-601),2.0,2.0,4.3,TITEX,84.0,5.0
13.0,100.0,Taffeta Black Double Layer Windcheater Jacket For Men,13.0,13.0,4.5,Fashion_House,71.0,10.0
90.0,98.0,Fancy Bird Fork Stand,90.0,90.0,4.2,BfYmYB9v,80.0,5.0
9.0,99.0,Thongs Underwear Panties Women Lace Underwear Sexy Breathable Hipster Panty Stretch Hollow Seamless Bikini Briefs (Crochet Lace Up Korean Panties),9.0,9.0,4.2,Savyata Stores,82.0,15.0
96.0,94.0,Shopmee Men's  Drill Twill Formal Beige Pant,96.0,96.0,4.2,Shop Mee,75.0,15.0
8.0,100.0,"Philips HL7756/00 Mixer Grinder 750 Watt, 3 Stainless Steel Multipurpose Jars with 3 Speed Control and Pulse function (Black)",8.0,8.0,4.2,DT,85.0,1.0
6.0,100.0,Hallow Fiber Half Sleeve Jacket For Men,6.0,6.0,4.1,Zeepas online store,70.0,2.0
65.0,100.0,3 in 1 Wooden Educational Board,65.0,65.0,4.1,Nepal Toys Store,78.0,15.0
855.0,0.0,"Ultima Watch Circle| 1.43"" Amoled Display |BT Calling Smartwatch| IP68 Waterproof| Zinc Alloy Metal Frame Smart watch",855.0,855.0,4.1,Ultima Lifestyle,87.0,1.0
90.0,100.0,LCD Writing Tab 8.5 Inch With Pen Writing Pad,90.0,90.0,4.4,Nepal Toys Store,78.0,15.0
209.0,96.0,The Ordinary Niacinamide 10% Zinc 1% Serum 30 ML,209.0,209.0,0.0,Allure Cosmetics,87.0,10.0
3.0,98.0,Mx pro+ 4 IN 1 Mobile Gaming Accessories Combo Pack | Gaming Essentials,3.0,3.0,4.4,Sasto Gadgets And Accessories,78.0,1.0
46.0,100.0,"Baba's Nappy Baby Pull Up Diaper Economic Pack, Small (Pack of 54)",46.0,46.0,4.5,Baba's Nappy,88.0,8.0
56.0,93.0,Astaberry Neem & Aloe Face Wash - 100ml,56.0,56.0,4.5,Astaberry Bioscience,87.0,15.0
16.0,98.0,Momo Jali Net silicone mat 3 Pieces 36 CM,16.0,16.0,4.5,WOW'S ONLINE,76.0,15.0
1.0,91.0,"Ingco New 115 Piece Home Tool Set With 680 Watt 13mm Impact Corded Electric Drill, Screwdrivers",1.0,1.0,0.0,Ingco,92.0,15.0
122.0,79.0,The Psychology Of Money+Ikigai+The Subtle Art Of Not Giving+Atomic Habits l 4 Books Best Seller,122.0,122.0,5.0,Sasto Ma Book,86.0,15.0
41.0,100.0,Kingston A400 Internal SSD 2.5 128Gb/256Gb/512Gb SATA 3,41.0,41.0,5.0,Login Soltion Pvt Ltd,83.0,1.0
230.0,79.0,It Start With Us + It End With Us (Bestseller Combo),230.0,230.0,4.4,Sasto Ma Book,86.0,15.0
246.0,79.0,The Power Of Your Subconscious Mind By Joseph Murphy,246.0,246.0,4.1,Sasto Ma Book,86.0,1.0
198.0,79.0,Psychology Of Money Morgan Housel,198.0,198.0,4.8,Sasto Ma Book,86.0,15.0
275.0,79.0,Rich Dad Poor Dad: What the Rich Teach Their Kids About Money That the Poor and Middle Class Do Not!,275.0,275.0,4.8,Sasto Ma Book,86.0,2.0
34.0,100.0,Casio Stainless Steel Digital Watch For Men A158WA-1DF,34.0,34.0,4.8,HOURGLASS,89.0,1.0
15.0,100.0,Monster Trucks Inertia Car Toys For Kids | 360 Degree Stunt Flip Design 4 Wheel Drive Toy Car For Kids,15.0,15.0,4.8,Nepal Toys Store,78.0,1.0
52.0,97.0,650ml Cleaner Multi-Purpose Bubble Spray Foam for Kitchen Grease Bubble Cleaner Kitchen,52.0,52.0,0.0,Flash Sale,81.0,15.0
81.0,100.0,Baby Try Cycle With Push Handle,81.0,81.0,0.0,Forever kids,72.0,15.0
124.0,94.0,Handy Sized Bento Thermal Aluminum Insulated Lunch/Cover/Tiffin Bag With Outer Pouch Size 21*14cm*20cm,124.0,124.0,0.0,A&A Readymade,87.0,15.0
35.0,100.0,Sara Foods Beet Root Powder - 125gm,35.0,35.0,4.4,Sara Foods,88.0,15.0
24.0,93.0,Optimum Nutrition Gold Standard 100% Whey 2lbs Chocolate Flavor Primary Source Isolate Protein Powder,24.0,24.0,4.3,MuscleBlaze,92.0,10.0
76.0,100.0,INGCO 1200W High Pressure Washer with Aluminium Wire Motor and Auto Stop System HPWR12008,76.0,76.0,3.2,INGCO store,91.0,1.0
1159.0,92.0,Dr jk4 Vitamin C Collagen Sunscreen SPF 50+/+++200ml,1159.0,1159.0,3.2,Secret Island,91.0,1.0
161.0,96.0,Adjustable Wristband Elastic Wrist Wraps Bandages For Weightlifting (Color Varied) - Wrist Wrappers |,161.0,161.0,3.2,Nutrishop Nepal ,93.0,15.0
31.0,100.0,Chamomile Tea For Insomnia and Immunity - Nepal Tea Exchange - 16g Jar,31.0,31.0,4.2,Nepal Tea Exchange,93.0,15.0
18.0,100.0,QQ Lunch Box-800 Ml,18.0,18.0,4.2,Aryan Enterprises,81.0,15.0
6.0,91.0,Ingco High Pressure Washer 1400W 130bar - HPWR14008 | Multipurpose Electric Powered HIgh Pressure Washer,6.0,6.0,4.2,Ingco,92.0,1.0
903.0,100.0,Packaging Material - Bubble Wrap (10mtr),903.0,903.0,4.0,Scommerce,76.0,0.0
929.0,100.0,Packaging Material - Brown Wrapping Paper - 10 M,929.0,929.0,3.6,Scommerce,76.0,0.0
1671.0,100.0,Packaging Material - Bundle of 25 Flyers (6.5  x 8 ),1671.0,1671.0,4.2,Scommerce,76.0,0.0
222.0,100.0,"Packaging Material – Bundle of 25 Flyers (16"" x 20"")",222.0,222.0,4.2,Scommerce,76.0,1.0
153.0,100.0,Packaging Material – Shrink Wrap,153.0,153.0,4.2,Scommerce,76.0,1.0
311.0,100.0,"Packaging Material – Bundle of 25 Flyers (14"" x 18"")",311.0,311.0,4.2,Scommerce,76.0,1.0
1002.0,100.0,"Packaging Material - Bundle of 25 Flyers (8"" x 10"")",1002.0,1002.0,4.2,Scommerce,76.0,0.0
1179.0,100.0,Packaging Material - Bundle of 25 Flyers (10  x 12 ),1179.0,1179.0,3.6,Scommerce,76.0,0.0
725.0,100.0,"Packaging Material – Bundle of 25 Flyers (16"" x 12"")",725.0,725.0,3.6,Scommerce,76.0,0.0
141.0,100.0,"Packaging Material - Bundle of 10 Boxes (13.5"" x 10"" x 4.8"")",141.0,141.0,3.6,Scommerce,76.0,1.0
5.0,0.0,Chest Drawers.,5.0,5.0,4.8,Basement,0.0,1.0
64.0,99.0,Spn'S 6Mm Thick Double Color Anti-Slip Tpe Yoga Mat | Eco Friendly Lightweight Waterproof & Antiskid Yoga Mat,64.0,64.0,3.1,SPN'S,90.0,10.0
277.0,100.0,Designer Velvet King Size Quilt ( Sirak) For Minus Degree Celsius,277.0,277.0,4.2,Home Essentials,75.0,15.0
759.0,33.0,"Cetaphil Daily Advance Ultra Hydrating Lotion for Dry/Sensitive Skin 100gm, Long Lasting Moisturizer for Face & Body",759.0,759.0,4.6,Cetaphil,92.0,0.0
24.0,100.0,"Nature's Care Set Of 2 Food Supplements, Fish Oil 1000mg Omega 3, 200 Capsules & Multivitamin 120 Tablets",24.0,24.0,4.6,Nature's  Care,95.0,1.0
351.0,33.0,"Cetaphil Moisturising Lotion for Face & Body, 500 ml Normal to dry skin",351.0,351.0,4.6,Cetaphil,92.0,1.0
3.0,100.0,Apple iPad Mini 6 Wi-Fi + Cellular 64GB,3.0,3.0,4.3,E-tech,92.0,2.0
50.0,93.0,5 In 1 Electric Hair Styling Tool,50.0,50.0,4.3,A&D store,78.0,15.0
21.0,94.0,"Medellin Sunburst 38"" Carbon Fiber Acoustic Guitar With Accessories | Carbon Fiber Acoustic Guitar For Beginners",21.0,21.0,4.3,Kadence,81.0,1.0
70.0,98.0,2 in 1 BSDDP Motorcycle Shift Pad Boot Protector Antiskid Shoe Cover Rubber Gear Shifter Protector,70.0,70.0,4.4,Sansa Store,78.0,15.0
262.0,93.0,MuscleBlaze Raw Whey Protein Powder 2kg 66 servings Unflavored Labdoor USA Certified 24g Protein 5.2g BCAA 4.2g Glutamine,262.0,262.0,4.2,MuscleBlaze,92.0,1.0
12.0,98.0,Drools Optimum Performance Adult Dog Food - 20kg By Crown Aquatics,12.0,12.0,3.0,Crown Aquatics,91.0,15.0
1.0,81.0,Estelin Australian Pink Clay Mask 4-In-1 Treatment 100GM,1.0,1.0,0.0,DnS Store,88.0,1.0
2608.0,93.0,MuscleBlaze Creatine Monohydrate 100g 32 Servings Labdoor USA Certified Micronized Powder for Muscle Building,2608.0,2608.0,4.8,MuscleBlaze,92.0,1.0
76.0,100.0,"VESTEL 43"" Smart 1/8GB LED TV | 3 Years Warranty | Free Wall Mount | IPS Panel | Dolby Sound | Full HD | 43 Inch Smart Television",76.0,76.0,4.8,VESTEL,83.0,15.0
33.0,100.0,Sel Roti Maker / Machine Soli by smart selroti - orginal 20mm hole Quality,33.0,33.0,4.8,Khudra shopping,86.0,15.0
822.0,100.0,Sensitive Baby Wipes Pack Of 10 - 80 PCS/90 PCS,822.0,822.0,4.6,SWOYAMBHU MASALA PASAL 1630576634,93.0,15.0
193.0,92.0,Bagmati MP Rectangle Basket,193.0,193.0,4.6,Bagmati Plastics,88.0,15.0
78.0,98.0,(Buy1Get1Free) PUREPET Chicken And Vegetable Puppy Dry Dog Food 3kg By Crown Aquatics,78.0,78.0,4.6,Crown Aquatics,91.0,15.0
2.0,99.0,2Pcs Hair Grip Styling Bangs Paste Posts Hair Sticker Clip Magic Tape Fringe Hair Bang No Trace Hair Holder Barber Gripper,2.0,2.0,0.0,Savyata Stores,82.0,2.0
26.0,100.0,Whirlpool  200 IMPC Cls 1s  Grey Nep - 185 Litres Direct Cooling Single Door Refrigerator Grey,26.0,26.0,3.9,R.N Electronics,85.0,1.0
7.0,25.0,Madhuram Classic Pistachios/Pista | Organic Fresh Dry Fruits Nuts | 1Kg,7.0,7.0,4.3,Madhuram online store,86.0,1.0
341.0,100.0,Dr Morepen Digital Blood Pressure Monitor,341.0,341.0,4.3,HR Surgicals and Chemicals,90.0,15.0
97.0,94.0,Wireless CCTV Camera IMOU  Ranger 2 3MP  Wi-Fi CCTV Camera IPC-K2EP-3H1W (2K) White,97.0,97.0,4.3,BHILASH IT Traders,91.0,1.0
803.0,100.0,WOW Skin Science Onion Black Seed Hair Oil - With Comb Applicator 200 ml,803.0,803.0,4.3,WOW Skin Science,90.0,5.0
160.0,99.0,SPN's 20 Kg Adjustable Chrome Dumbbell Set With Barbell Connector | Adjustable Dumbbell With Easy Grip Handle & Barbell Connector - 20Kg,160.0,160.0,4.3,SPN'S,90.0,1.0
28.0,98.0,Pair Of Anti Uv Arm Sleeves - Multicolor,28.0,28.0,4.3,Sale Sansar,85.0,15.0
1.0,92.0,Dancing Robot With 360° Rotating Flashing Light And Sound,1.0,1.0,4.3,Kabita General Store,76.0,15.0
86.0,99.0,USB Rechargable Ultra Bright Bike Light Set With Horn | Rechargeable Bike Light For Safety Night Riding ( Multicolor),86.0,86.0,4.2,SAM Prolife Nutrition Nepal,87.0,15.0
12.0,99.0,SPN'S 2 In 1 30Kg Dumbbell Set With Barbell Connecter,12.0,12.0,4.6,SAM Prolife Nutrition Nepal,87.0,10.0
128.0,100.0,Styleys Cabinet Shoe Rack with Cover for Home/Office Wardrobe Cube Organizer Black (12 Cube) - Shoe Racks |,128.0,128.0,4.8,bharpardo online store,86.0,1.0
16.0,100.0,"Nature's Care Set Of 2 Food Supplements, Fish Oil, 1000mg Omega 3, 200 Capsules & Glucosamine HCL, 1000mg, 180 Capsules",16.0,16.0,3.9,Nature's  Care,95.0,1.0
490.0,99.0,Resistance Pull Up Bands  Pull Up Assist Band,490.0,490.0,3.9,SAM Prolife Nutrition Nepal,87.0,10.0
1053.0,100.0,"Nature's Care Australia Fish Oil, Omega 3, 1000mg, 200 Capsules",1053.0,1053.0,3.9,Nature's  Care,95.0,1.0
